Category,Title,text,Image URL
მსოფლიო ამბები,ოლენა ზელენსკა: ქმარს ომიც კი ვერ წამართმევს,"უკრაინის პირველმა ლედიმ, ოლენა ზელენსკამ ერთ-ერთ ინტერვიუში ომის დაწყების დღე გაიხსენა. ამის შესახებ პირველმა ლედიმ უკრაინულ ICTV -სთან ინტერვიუში ისაუბრა. ზელენსკა იხსენებს, როგორ გააღვიძა ფანჯრის მი…",http://exclusivenews.ge/wp-content/uploads/2022/05/olena_w_h-370x260.jpeg
მსოფლიო ამბები,"ანჯეი დუდა რადაში სიტყვით გამოვიდა – დროა, დაიდოს ახალი ხელშეკრულება უკრაინასთან კეთილმეზობლობის შესახებ","ვარშავისა და კიევის მეგობრული ურთიერთობების გათვალისწინებით, რაც განსაკუთრებით გამოიკვეთა უკრაინის წინააღმდეგ რუსეთის სრულმასშტაბიანი ომის პირობებში, უკრაინასა და პოლონეთს შორის კეთილმეზობლობის შესახე…",http://exclusivenews.ge/wp-content/uploads/2022/05/1653218188-ანჯეი-დუდა-370x260.jpg
მსოფლიო ამბები,უკრაინის პარლამენტმა საომარი მდგომაროება ზაფხულის ბოლომდე გაახანგრძლივა,უკრაინის პარლამენტმა საომარი მდგომაროება ზაფხულის ბოლომდე გაახანგრძლივა. გადაწყვეტილებას მხარი 320 დეპუტატმა დაუჭირა. დღესვე უკრაინის პარლამენტმა მხარი დაუჭირა საყოველთაო მობილიზაციის 23 აგვისტომდე გა…,http://exclusivenews.ge/wp-content/uploads/2022/05/1653221619-2-370x260.jpg
მსოფლიო ამბები,"თალიბების ბრძანების შესაბამისად, ავღანეთში ტელეწამყვანმა ქალებმა სახეები დაიფარეს","ავღანეთის ტელეარხების წამყვანი ქალები და რეპორტიორები დღეს ეთერში სახედაფარულები გამოჩნდნენ. მიზეზი თალიბანის ახალი ბრძანებაა, – ამის შესახებ BBC წერს. ჯერ კიდევ რამდენიმე დღის წინ, ზოგიერთმა წა…",http://exclusivenews.ge/wp-content/uploads/2022/05/E5BD5ECF-665C-43BC-9F60-048A82EEAE23-370x260.jpeg
მსოფლიო ამბები,პორტუგალია უკრაინისთვის 250 მილიონ ევრომდე დახმარებას გამოყოფს,"პორტუგალია უკრაინას 250 მილიონ ევრომდე ფინანსურ დახმარებას გაუწევს. შესაბამის მემორანდუმს ხელი პორტუგალიის პრემიერ-მინისტრის, ანტონიუ კოშტას კიევში ვიზიტის დროს მოეწერა. „უკრაინა წელს პირველ ტრანშს 10…",http://exclusivenews.ge/wp-content/uploads/2022/05/70BF89D3-AB45-44A3-93FC-912E4E3F805C-370x260.jpeg
მსოფლიო ამბები,უკრაინა რუსეთის UNESCO-დან გარიცხვას მოითხოვს,"უკრაინა გეგმავს, მიმართოს გაეროს განათლების, მეცნიერებისა და კულტურის ორგანიზაციას რუსეთისთვის წევრი სახელმწიფოს სტატუსის ჩამორთმევის მოთხოვნით, – ინფორმაციას უკრაინული მედია ავრცელებს. Ukrinfor…",http://exclusivenews.ge/wp-content/uploads/2022/05/0E8F6350-89DA-44EA-B19C-B9BAFD134A55-370x260.jpeg
მსოფლიო ამბები,უკრაინის გენშტაბი განცხადებას ავრცელებს,"უკრაინაში რუსეთის შეჭრის 88-ე დღეს ოკუპანტები არ წყვეტენ შეტევით მოქმედებებს ქვეყნის აღმოსავლეთის საოპერაციო ზონაში და უკრაინის მთელ ტერიტორიაზე სარაკეტო ავიადარტყმები კვლავ მიმდინარეობს, – ამის შესახ…",http://exclusivenews.ge/wp-content/uploads/2022/05/57D76872-DC2A-4477-BEDB-DF8F69791CCC-370x260.jpeg
მსოფლიო ამბები,"ვოლოდიმირ ზელენსკის განცხადებით, ვითარება დონბასში უკიდურესად მძიმეა","უკრაინის პრეზიდენტის ვოლოდიმირ ზელენსკის განცხადებით, ვითარება დონბასში უკიდურესად მძიმეა. პრეზიდენტის თქმით, რუსული ჯარი ცდილობს სლავიანსკსა და სევეროდონეცკზე შეტევას. ამის შესახებ მან ვიდეომიმართვაშ…",http://exclusivenews.ge/wp-content/uploads/2022/05/zelenski86-370x260.jpg
მსოფლიო ამბები,პოლონეთის პრეზიდენტი უკრაინაშია,"პოლონეთის პრეზიდენტი, ანდჟეი დუდა უკრაინაში ჩავიდა და სავარაუდოდ, დღეს, 22 მაისს, უმაღლეს რადას სიტყვით მიმართავს, – ინფორმაციას უკრაინული მედია პოლონეთის რესპუბლიკის პრეზიდენტის ოფისზე დაყრდნობ…",http://exclusivenews.ge/wp-content/uploads/2022/05/4EC41A89-F35D-4DCE-A578-446BAA4447D6-370x260.jpeg
მსოფლიო ამბები,გერმანიაში უამინდობის შედეგად 40-ზე მეტი ადამიანი დაშავდა,"დასავლეთ გერმანიის რამდენიმე ქალაქში, ტორნადოს შედეგად, 43 ადამიანი დაშავდა, – ამის შესახებ BBC წერს. ქალაქ პადერბორნში, ოფიციალური პირები აცხადებენ, რომ, უამინდობის შედეგად, არაერთი სახლის სახუ…",http://exclusivenews.ge/wp-content/uploads/2022/05/DDF1D730-9764-452D-964A-45DB082B5534-370x260.jpeg
მსოფლიო ამბები,"“დამოუკიდებელი უკრაინა იმაზე გაცილებით დიდხანს იარსებებს, ვიდრე ვლადიმერ პუტინი იქნება სცენაზე”","„ყველაზე მნიშვნელოვანი არის ის, რომ 82 დღის შემდეგაც, უკრაინელები იცავენ თავიანთ თავისუფლებასა და სუვერენიტეტს. მათთან ერთადაა მსოფლიოს უდიდესი ნაწილი“, – აცხადებს ამერიკის შეერთებული შტატების ს…",http://exclusivenews.ge/wp-content/uploads/2022/03/blinkeni-370x260.jpg
მსოფლიო ამბები,"ორი მცირეწლოვანი შვილის მკვლელობისა და ცოლის დაჭრის საქმეზე, თურქეთში 38 წლის კაცი დააკავეს","თურქეთში 38 წლის კაცი ორი შვილის მკვლელობისა და მეუღლის დაჭრის ბრალდებით დააკავეს. ის უკრაინის მოქალაქეა, – ინფორმაციას Ukrinform-ითურქულ მედიაზე დაყრდნობით ავრცელებს. მედიის ცნობით, შემთხვევა 2…",http://exclusivenews.ge/wp-content/uploads/2022/05/6053F57C-F4F7-415D-8D62-A14715975305-370x260.jpeg
მსოფლიო ამბები,უკრაინაში შოიგუს მოადგილის დისშვილი გარდაიცვალა,"რუსული მედიის ინფორმაციით, უკრაინაში რუსეთის თავდაცვის მინისტრის სერგეი შოიგუს მოადგილის დისშვილი გარდაიცვალა. საუბარია ადამ ხამკოევზე, რომელიც სადესანტო დანაყოფის კაპიტანი იყო. მედიები წერენ, რომ ხამ…",http://exclusivenews.ge/wp-content/uploads/2022/05/suenvccspamtbsj-370x260.jpg
მსოფლიო ამბები,“მოსკოვი აპირებს შეისწავლოს ვიქტორ მედვედჩუკის “აზოველებში” გაცვლის შესაძლებლობა”,"მოსკოვი აპირებს შეისწავლოს უკრაინის უშიშროების სამსახურის მიერ დაკავებული ვიქტორ მედვედჩუკის უკრაინელ ტყვეებში გაცვლის შესაძლებლობა – ამის შესახებ უკრაინა-რუსეთის მოლაპარაკების პროცესის წევრმა, …",http://exclusivenews.ge/wp-content/uploads/2022/05/medvedchuki-370x260.jpg
მსოფლიო ამბები,“აზოვსტალის” თავზე უკრაინის დროშა აღარ ფრიალებს – რა ბედი ელით მარიუპოლის მცველებს,“აზოვსტალის” თავზე უკრაინის დროშა აღარ ფრიალებს. აზოვის ბატალიონის წევრები ოკუპანტებს სრულად ჩაბარდნენ და ამით უმაღლესი მთავარსარდლობის ბრძანება შეასრულეს. 2500-მდე ადამიანის სიცოცხლე ამ დ…,http://exclusivenews.ge/wp-content/uploads/2022/05/azov-1-370x260.jpg
მსოფლიო ამბები,"ხარკოვში რუსი ოკუპანტების სამარხები აღმოაჩინეს, მათ შორის პოლკოვნიკის","ხარკოვის ოლქში, ზოლოჩივის რაიონში რუსი ოკუპანტების სამარხები აღმოაჩინეს – ინფორმაციას ხარკოვის ოლქის პოლიციის საგამოძიებო დეპარტამენტის უფროსი, სერგეი ბოლვინოვი სოციალურ ქსელში ავრცელებს. ბოლვინ…",http://exclusivenews.ge/wp-content/uploads/2022/05/samarxi-370x260.jpg
მსოფლიო ამბები,რუსეთში ე.წ. უცხოელი აგენტების სიაში მიხაილ ხოდორკოვსკი და გარი კასპაროვი შეიყვანეს,"რუსეთის იუსტიციის სამინისტრომ ე.წ. უცხოელი აგენტების სიაში  ყოფილი მაგნატი, მიხაილ ხოდორკოვსკი და ჭადრაკის ყოფილი მსოფლიო ჩემპიონი, გარი კასპაროვი შეიყვანა. სამინისტრო ორივეს პრეტენზიას უყენებს, რომ პ…",http://exclusivenews.ge/wp-content/uploads/2022/05/229747_cover_b-370x260.jpg
მსოფლიო ამბები,"რუსეთმა აშშ-ის 963 მოქალაქეს, მათ შორის პრეზიდენტ ჯო ბაიდენს, ქვეყანაში შესვლა აუკრძალა","რუსეთმა აშშ-ის 963 მოქალაქეს, მათ შორის პრეზიდენტ ჯო ბაიდენს, ქვეყანაში შესვლა აუკრძალა. რუსეთის საგარეო უწყების ვებგვერდზე გამოვეყნებული განცხადების თანახმად, სასანქციო სიაში მოხვდნენ ასევე აშშ-ის სა…",http://exclusivenews.ge/wp-content/uploads/2022/04/baideni555-370x260.jpg
მსოფლიო ამბები,ბორის ჯონსონმა უკრაინის ომისა და ნატო-ს გაფართოების საკითხებზე რეჯეფ თაიფ ერდოღანთან ტელეფონით ისაუბრა,"დიდი ბრიტანეთის პრემიერ-მინისტრმა, ბორის ჯონსონმა უკრაინაში მიმდინარე ომისა და ნატო-ს გაფართოების საკითხებზე თურქეთის პრეზიდენტთან სატელეფონო საუბარი გამართა. ინფორმაციას ბრიტანეთის პრემიერ-მინისტრის …",http://exclusivenews.ge/wp-content/uploads/2022/05/jonsoni-1-370x260.jpg
მსოფლიო ამბები,“ახლა შევდივართ ომის დასკვნით ფაზაში”,"ფრონტის ხაზი უცვლელია, ომის 87-ე დღეს, რუსეთი უკრაინაში საბრძოლო მოქმედებებს არ წყვეტს. იბომბება ლუგანსკის ოლქი, საბრძოლო მოქმედებები გრძელდება ხარკოვშიც. ომი დასკვნით ფაზაში შედის – ეს კიევის ო…",http://exclusivenews.ge/wp-content/uploads/2022/04/podoliak-370x260.jpg
