Category,Title,text,Image URL
მსოფლიო ამბები,"“ნაკლებად სავარაუდოა, რომ უკრაინამ მიიღოს ევროკავშირის კანდიდატის სტატუსი”","პრემიერ-მინისტრ მარკ რუტეს აზრით, შანსი იმისა, რომ უკრაინა მალე გახდეს ევროკავშირის წევრობის კანდიდატი, არც ისე დიდია. ევროკავშირის ძალიან ბევრ ქვეყანას არ მოსწონს ეს იდეა. ეს ასევე უსამართლო იქნება დ…",http://exclusivenews.ge/wp-content/uploads/2022/05/DFF52DEC-B669-43B8-8227-DD7EC66BB4C2-370x260.jpeg
მსოფლიო ამბები,"“საწვავის ფასებს თუ გადავხედავთ, რთული სიტუაციის წინაშე ვართ, ჩვენ ვერ შევძლებთ მათ სუბსიდირებას, ამიტომ აუცილებელია საწვავის წარმოების გაზრდა”","გერმანიის კანცლერის ოლაფ შოლცის განცხადებით, პუტინის გადაწყვეტილება, აწარმოოს სასტიკი ომი უკრაინაში, იმპერიალისტური მიდგომაა. აღნიშნულის შესახებ ოლაფ შოლცმა „დოიჩე ველესთვის“ მიცემულ ექსკლუზიურ ინტერვ…",http://exclusivenews.ge/wp-content/uploads/2022/04/sholci-370x260.jpg
მსოფლიო ამბები,"“რუსი ქურდები იპარავენ უკრაინულ მარცვლეულს, ტვირთავენ გემებზე, გადიან ბოსფორის სრუტეში და მის გაყიდვას საზღვარგარეთ ცდილობენ”","უკრაინის საგარეო საქმეთა მინისტრი, დმიტრო კულება მოუწოდებს ყველა ქვეყანას, უარი თქვას რუსების წინადადებაზე, შეიძინონ უკრაინიდან მოპარული მარცვლეული, – ამის შესახებ საგარეო უწყების ხელმძღვანელი T…",http://exclusivenews.ge/wp-content/uploads/2022/04/kuleba-370x260.jpg
მსოფლიო ამბები,შოტლანდიის ეკლესია ერთნაისქესიანთა ქორწინებას დაუშვებს,"შორლანდიაში, ერთნაირსქესიან წყვილები შეძლებენ საეკლესიო ცერემონიით დაქორწინებას, რომელსაც ეკლესიის მსახური წარმართავს, – ინფორმაციას BBC ავრცელებს. მრავალწლიანი მსჯელობის შემდეგ, შოტლანდიის ეკლე…",http://exclusivenews.ge/wp-content/uploads/2022/05/untitled-design-9-1-370x260.jpg
მსოფლიო ამბები,"“რუსეთის აგრესიის საპასუხოდ, ნატო-ს აქვს ორი ამოცანა, უკრაინისთვის მხარდაჭერის აღმოჩენა და ომის ესკალაციის თავიდან აცილება”","ნატო-ს გენერალური მდივნის იენს სტოლტენბერგის განცხადებით, უკრაინაში პრეზიდენტ პუტინის ომმა დაამსხვრია მშვიდობა ევროპაში. სტოლტენბერგის თქმით, ეს ნამდვილად გარდამტეხი მომენტია არა მხოლოდ ევროპის უსაფრთ…",http://exclusivenews.ge/wp-content/uploads/2022/02/stoltenbergi111-370x260.jpg
მსოფლიო ამბები,მოლდოვის ყოფილი პრეზიდენტი 72 საათით დააკავეს,"მოლდოვის ყოფილი პრეზიდენტი 72 საათით დააკავეს. იგორ დოდონი სახელმწიფო ღალატშია ეჭვმიტანილი. მედიის ინფორმაციით, აღნიშნულის შესახებ მოლდოვის გენერალური პროკურატურის პრესმდივანმა, მარიანა კიორპეკმა განა…",http://exclusivenews.ge/wp-content/uploads/2022/05/1653380247-იგორ-დოდონი-e1653380257297-370x260.jpg
მსოფლიო ამბები,ვლადიმერ სოლოვიოვი გერმანიის კანცლერს ემუქრება,"კრემლის პროპაგანდისტი ჟურნალისტი ვლადიმერ სოლოვიოვი ამჯერად ჯოზეფ ბორელს, ოლაფ შოლცსა და ურსულა ფონ დერ ლაიენს ემუქრება. ,,ნაციზმი – ფრაზაც კი, კანცლერი შოლცისგან არის სასაცილო. რუსების მიერ დონბასის …",http://exclusivenews.ge/wp-content/uploads/2022/05/BeFunky-collage-71-370x260.jpg
მსოფლიო ამბები,"დმიტრი გორდონი: შეუძლებელია იმის თქმა, რომ ჩვენ რაღაც მივიღეთ","ვიდრე ხერსონის ოლქი სრულად ოკუპირებულია, ვიდრე ოკუპირებულია დონეცკისა და ლუგანსკის ოლქების დამატებითი ნაწილები, ხარკოვის ოლქის ნაწილი, ზაპოროჟიეს ოლქის უმეტესი ნაწილი, შეუძლებელია იმის თქმა, რომ ჩვენ …",http://exclusivenews.ge/wp-content/uploads/2022/05/gordon-370x260.jpg
მსოფლიო ამბები,კიევის სასამართლომ ვიქტორ იანუკოვიჩის დაკავების ნებართვა გასცა,კიევის პეჩერსკის რაიონულმა სასამართლომ ექსპრეზიდენტ ვიქტორ იანუკოვიჩს რუსეთის სასარგებლოდ ხარკოვის ხელშეკრულებებზე ხელმოწერის საქმეზე აღკვეთის ღონისძიება განუსაზღვრა და დაკავების ნებართვა გასცა. გამოძ…,http://exclusivenews.ge/wp-content/uploads/2022/05/ianukovichi-370x260.jpg
მსოფლიო ამბები,ისრაელი უკრაინელ ლტოლვილებს მუშაობის უფლებას მისცემს,"ისრაელი დათანხმდა იმ უკრაინელებისთვის სამუშაო ნებართვის მიცემას, რომლებიც იძულებულნი არიან დარჩნენ ქვეყანაში უკრაინასთან ომის გამო. ამის შესახებ 23 მაისს, ისრაელში უკრაინის საელჩომ ფეისბუქზე განაცხადა…",http://exclusivenews.ge/wp-content/uploads/2019/05/israeli-370x260.jpg
მსოფლიო ამბები,ზელენსკიმ პუტინთან შეხვედრის პირობა დაასახელა,"უკრაინის პრეზიდენტმა, ვოლოდიმირ ზელენსკიმ განაცხადა, რომ მზად არის რუსეთის პრეზიდენტ ვლადიმერ პუტინთან მოლაპარაკებისთვის მხოლოდ იმ შემთხვევაში, თუ ისინი ომის დასრულებას განიხილავენ, რომელიც რუსეთმა უკ…",http://exclusivenews.ge/wp-content/uploads/2021/04/putin-zelenski-370x260.jpg
მსოფლიო ამბები,"​”გამაღვიძა ფანჯრის მიღმა უცნაურმა ხმებმა, ვოლოდიმირს ვკითხე, რა ხდებოდა და მან მითხრა მხოლოდ: დაიწყო! და წავიდა”",როგორ შეიცვალა უკრაინის პირველი პირისა და პირველი ლედის ოჯახის ცხოვრება რუსეთ-უკრაინის ომის დაწყების შემდეგ – სამხედრო აგრესიის თითქმის სამი თვის განმავლობაში პრეზიდენტი ვოლოდიმირ ზელენსკი ტელეე…,http://exclusivenews.ge/wp-content/uploads/2022/05/zrlrnskebi-370x260.jpg
მსოფლიო ამბები,პუტინი მეგობარს და საკუთარი ნათლულის მამას “აზოველებში“ არ გადაცვლის,"რუსეთის პრეზიდენტის პრესსამსახურის უფროსმა, დმიტრი პესკოვმა გამორიცხა “აზოვსტალელი” მებრძოლების ვიქტორ მედვედჩუკში გაცვლა.  “შეუძლებელია ამაზე საუბარი, ეს სხვადასხვა კატეგორიაა,̶…",http://exclusivenews.ge/wp-content/uploads/2022/05/putini-medvedchuki2-370x260.jpg
მსოფლიო ამბები,“თქვენ მარტო არ ხართ” – ბორის ჯონსონის წერილი უკრაინელ ბავშვებს,"მჯერა, რომ უკრაინა ამ ომს მოიგებს და იმედი მაქვს, მალე თავისუფლად შეძლებთ საკუთარ სახლებში, სკოლებსა და ოჯახებში დაბრუნებას – ასე მიმართავს გაერთიანებული სამეფოს პრემიერი უკრაინელ ბავშვებს, ბორი…",http://exclusivenews.ge/wp-content/uploads/2022/05/229826_video-370x260.jpg
მსოფლიო ამბები,უკრაინელებმა კიდევ ერთი რუსი გენერალი მოკლეს,"უკრაინული მედიის ინფორმაციით, ლიკვიდირებულია კიდევ ერთი რუსი გენერალი – კანამატ ბოტაშევი. როგორც უკრაინული მედიასაშუალებები წერენ, უკრაინელებმა პოპასნაში რუსული თვითმფრინავი სუ-25 ჩამოაგდეს, რომელსაც …",http://exclusivenews.ge/wp-content/uploads/2022/05/6ppp.png-370x260.jpg
მსოფლიო ამბები,“არ დაელოდოთ ბირთვულ იარაღს და გამოიყენეთ მაქსიმალური სანქციები”,"არ დაელოდოთ ბირთვულ იარაღს და გამოიყენეთ მაქსიმალური სანქციები, – ასე მიმართა უკრაინის პრეზიდენტმა, ვოლოდიმირ ზელენსკიმ დავოსის მსოფლიო ეკონომიკური ფორუმის მონაწილეებს. უკრაინის პრეზიდენტის თქმით, სან…",http://exclusivenews.ge/wp-content/uploads/2022/03/zelenski-13-370x260.jpg
მსოფლიო ამბები,უკრაინის სასამართლომ სამხედრო დანაშაულში ბრალდებულ რუს სამხედროს სამუდამო პატიმრობა მიუსაჯა,უკრაინის სასამართლომ მშვიდობიანი მოქალაქის მკვლელობისთვის რუს ჯარისკაცს სამუდამო პატიმრობა მიუსაჯა. ინფორმაციას ამის შესახებ სააგენტო Reuters-ი ავრცელებს. სასამართლომ ვადიმ შიშიმარინი დამნაშავედ ცნო 2…,http://exclusivenews.ge/wp-content/uploads/2022/05/rusi-370x260.jpg
მსოფლიო ამბები,რუსეთის საგარეო საქმეთა სამინისტრო “აზოვსტალიდან“ გაყვანილ პირებთან დაკავშირებით მოლაპარაკებების შესაძლებლობას არ გამორიცხავს,"რუსეთის საგარეო საქმეთა სამინისტროში „აზოვსტალიდან“ აყვანილი ტყვეების გაცვლასთან დაკავშირებით მოლაპარაკებების გამართვის შესაძლებლობას არ გამორიცხავენ. ჟურნალისტის კითხვაზე, იგეგმება თუ არა „აზოვსტალის…",http://exclusivenews.ge/wp-content/uploads/2016/10/ruseti-sagareo-370x260.jpg
მსოფლიო ამბები,ოკუპანტებმა დონეცკის ოლქში 12 დასახლება დაბომბეს,"ოკუპანტებმა დონეცკის ოლქში 12 დასახლება დაბომბეს, – ამის შესახებ ინფორმაციას დონეცკის ოლქის პოლიცია ავრცელებს. მათივე ცნობით, დაბომბვას 6 მშვიდობიანი მოქალაქე ემსხვერპლა, 11 ადამიანი კი დაიჭრა. ”ოკუპა…",http://exclusivenews.ge/wp-content/uploads/2022/05/ukraina-omi-9-370x260.jpg
მსოფლიო ამბები,ვიქტორ მედვედჩუკმა პეტრო პოროშენკოს წინააღმდეგ ჩვენება მისცა,"ვიქტორ მედვედჩუკმა პეტრო პოროშენკოს წინააღმდეგ „ნახშირის„ და „მილსადენის“ საქმეებში ჩვენება მისცა. უკრაინული მედიის ცნობით, სახელმწიფო ღალატსა და ტერორიზმის დახმარებაში ეჭვმიტანილმა, ვლადიმერ პუტინის …",http://exclusivenews.ge/wp-content/uploads/2022/05/medvedchuki-1-370x260.jpg
მსოფლიო ამბები,ხარკოვში ნანგრევებიდან 150-ზე მეტი ცხედარი ამოიყვანეს,"უკრაინაში რუსეთის სრულმასშტაბიანი შეჭრიდან, ხარკოველმა მაშველებმა 98 განადგურებული ობიექტის ნანგრევებიდან 150-ზე მეტი ცხედარი ამოიყვანეს. ამის შესახებ ხარკოვის ოლქის საგანგებო სიტუაციების სახელმწიფო ს…",http://exclusivenews.ge/wp-content/uploads/2022/05/ukraina-omiii-370x260.jpg
მსოფლიო ამბები,“ევროკავშირმა მეტი პასუხისმგებლობა უნდა აიღოს საკუთარ უსაფრთხოებაზე”,"უსაფრთხოების ახალი გარემო აჩვენებს, რომ ევროკავშირმა უნდა აიღოს მეტი პასუხისმგებლობა საკუთარ უსაფრთხოებაზე, – ამის შესახებ ევროკავშირის საგარეო ქმედებათა სამსახურის ხელმძღვანელი ჯოზეფ ბორელი საკუთარ ბ…",http://exclusivenews.ge/wp-content/uploads/2022/05/boreli-370x260.jpg
მსოფლიო ამბები,"“მოვუწოდებთ ქვეყნებს, საჭიროების შემთხვევაში, კოვიდშეზღუდვებისთვის იყვნენ მზად”","ჯანდაცვის მსოფლიო ორგანიზაციის გენერალური დირექტორის, ტედროს ადანომ გებრეისუსის განცხადებით, Covid-ის შემთხვევების ზრდა მსოფლიოს თითქმის 70 ქვეყანაში ფიქსირდება. ამის შესახებ მან ჯანდაცვის მსოფლიო 75-…",http://exclusivenews.ge/wp-content/uploads/2020/04/janmo-370x260.jpg
მსოფლიო ამბები,ფილიპინებზე გემზე გაჩენილი ხანძრის შედეგად 7 მგზავრი დაიღუპა,"ფილიპინებზე გემზე გაჩენილი ხანძრის შედეგად, სულ მცირე, 7 მგზავრი დაიღუპა. ამის შესახებ ინფორმაციას CNN Philippines სანაპირო დაცვაზე დაყრდნობით ავრცელებს. „სულ მცირე, შვიდი ადამიანი დაიღუპა, 105 გადაარ…",http://exclusivenews.ge/wp-content/uploads/2022/05/111111111111-370x260.jpg
მსოფლიო ამბები,“გაყინული რუსული სახსრები უკრაინის ომის შემდგომ აღდგენას უნდა მოხმარდეს”,"უკრაინის ომის შემდგომი რეკონსტრუქცია უნდა მოხდეს გაყინული რუსული სახსრებით, მაგრამ ასევე საჭიროა სპეციალური პროგრამები ევროპიდანაც, – ამის შესახებ პოლონეთის პრეზიდენტმა ანჯეი დუდამ უკრაინელ კოლეგა ვოლ…",http://exclusivenews.ge/wp-content/uploads/2022/05/duda-370x260.jpeg
მსოფლიო ამბები,ირანის რევოლუციური გვარდიის მაღალი რანგის წევრი საკუთარ სახლთან მოკლეს,"ირანის გავლენიანი „ისლამური რევოლუციის გუშაგთა კორპუსის“ მაღალი რანგის წევრი, თეირანში, თავის სახლთან მოკლეს, იტყობინება ირანის მედია, „კორპუსის“ მონაცემებზე დაყრდნობით. საიად ხოდაი „მოკლეს ორი მოტოცი…",http://exclusivenews.ge/wp-content/uploads/2022/05/download-1-370x260.jpg
მსოფლიო ამბები,ბანგლადეშსა და ინდოეთში წყალდიდობას მსხვერპლი მოჰყვა,"ბანგლადეშსა და ინდოეთში წყალდიდობის შედეგად 50-ზე მეტი ადამიანი დაიღუპა. ამის შესახებ BBC წერს. გამოცემის ინფორმაციით, სტიქიამ მილიონობით ადამიანი დააზარალა. ამასთან, ბანგლადეშში ბოლო 20 წლის განმავლო…",http://exclusivenews.ge/wp-content/uploads/2022/05/imedinews-45-370x260.jpg
მსოფლიო ამბები,“უკრაინის ევროკავშირში გაწევრიანებას 15 ან 20 წელი დასჭირდება”,"საფრანგეთის სახელმწიფო მდივანმა ევროპის საკითხებში, კლემენტ ბონმა ფრანგულ რადიო J-სთან ინტერვიუში თქვა, რომ უკრაინის ევროკავშირში გაწევრიანებას დაახლოებით 15-20 წელი დასჭირდება. “ჩვენ გულახდილებ…",http://exclusivenews.ge/wp-content/uploads/2022/05/BAE78C29-4434-4532-B931-AA86F31D35E1-370x260.jpeg
მსოფლიო ამბები,"მედიის ცნობით, ბალტიის სახელმწიფოებმა რუსეთიდან ელექტროენერგიის იმპორტი შეწყვიტეს","ბალტიის სახელმწიფოებმა რუსეთიდან ელექტროენერგიის იმპორტი შეწყვიტეს. ინფორმაციას ადგილობრივი მედია ავრცელებს. მედიის ცნობით, ლიეტუვის შემთხვევაში ეს ნიშნავს, რომ ქვეყანა რუსეთიდან ყველა ენერგორესურსის …",http://exclusivenews.ge/wp-content/uploads/2022/05/8826E0FE-4BF3-4F2C-9A28-1B7520495533-370x260.jpeg
მსოფლიო ამბები,სარაკეტო იერიშები ზაპოროჟიეზე – არიან დაშავებულები,"ღამით ოკუპანტებმა სარაკეტო იერიშები ზაპოროჟიეზე მიიტანეს. არიან დაშავებულები. ზაპოროჟიეს ოლქის სამხედრო ხელძღვანელობის ცნობით, რუსმა სამხედროებმა შეტევა მაისს 02:44 საათზე განახორციელეს. დაზიანებულია …",http://exclusivenews.ge/wp-content/uploads/2022/05/zaporojie3-370x260.png
